{
  "id": "free_5_pentagon_re",
  "family": "free_5",
  "n_bodies": 5,
  "G": 1.0,
  "masses": [
    1.0,
    1.0,
    1.0,
    1.0,
    1.0
  ],
  "period": 5.355627818278749,
  "positions": [
    [
      1.0,
      -2.2204460492503132e-17,
      0.0
    ],
    [
      0.30901699437494745,
      0.9510565162951535,
      0.0
    ],
    [
      -0.8090169943749473,
      0.5877852522924732,
      0.0
    ],
    [
      -0.8090169943749475,
      -0.587785252292473,
      0.0
    ],
    [
      0.30901699437494723,
      -0.9510565162951536,
      0.0
    ]
  ],
  "velocities": [
    [
      8.881784197001253e-17,
      1.173193044844357,
      0.0
    ],
    [
      -1.1157728901713782,
      0.3625365885393962,
      0.0
    ],
    [
      -0.6895855698516152,
      -0.9491331109615746,
      0.0
    ],
    [
      0.6895855698516151,
      -0.9491331109615746,
      0.0
    ],
    [
      1.1157728901713782,
      0.36253658853939597,
      0.0
    ]
  ],
  "names": [
    "B1",
    "B2",
    "B3",
    "B4",
    "B5"
  ],
  "symmetry": "regular_5_gon_relative_equilibrium",
  "source": "analytic: \u03c9\u00b2 = G m S_n / R\u00b3, S_n=\u03a3 1/(4 sin(\u03c0k/n))",
  "notes": "Path A free equal-mass seed (inertial period = one full rotation).",
  "central_index": null
}