{
  "id": "hier_1plus4_manifold",
  "family": "hier_1plus4",
  "n_bodies": 5,
  "G": 1.0,
  "masses": [
    1.0,
    0.001,
    0.001,
    0.001,
    0.001
  ],
  "period": 6.283185307179586,
  "positions": [
    [
      0.00038270799948398427,
      0.00019060724743676455,
      -1.7809646669177986e-05
    ],
    [
      0.5488654637296285,
      0.5486733629775813,
      0.5484649460834753
    ],
    [
      0.635609859314957,
      -0.6350365440680361,
      -0.6352449609621421
    ],
    [
      -0.731279020843693,
      0.7318523360906138,
      -0.7316795384898462
    ],
    [
      -0.8359043016848762,
      -0.8360964024369234,
      0.836269200037691
    ]
  ],
  "velocities": [
    [
      -0.0030203971318430367,
      1.9363754381278942e-05,
      6.972082500288605e-05
    ],
    [
      0.855374678147109,
      -0.42917817388509494,
      -0.4291278168144733
    ],
    [
      0.804736027090981,
      0.3844964425430067,
      0.3845467996136283
    ],
    [
      0.7093292692536255,
      0.38820199284921614,
      -0.38811290826983197
    ],
    [
      0.6509571573513195,
      -0.3628840158884068,
      0.36297310046779097
    ]
  ],
  "names": [
    "central",
    "T1",
    "T2",
    "T3",
    "T4"
  ],
  "symmetry": "Td_rays_linear_poly",
  "source": "fairy_orbit.design.manifold.ManifoldParams default Path-B seed",
  "notes": "Not expected to be periodic; baseline hierarchical IC for \u03bc-continuation.",
  "central_index": 0
}